{
  "key": "income",
  "title": "Income Sources",
  "icon": "üí∞",
  "description": "Monthly income from all sources",
  "estimated_time": "2-3 min",
  "required": true,
  "sort_order": 1,
  "sections": [
    {
      "id": "intro",
      "type": "intro",
      "title": "Income Assessment",
      "icon": "üí∞",
      "help_text": "Let's identify all sources of monthly income to understand your financial resources.",
      "fields": []
    },
    {
      "id": "social_security",
      "title": "Social Security Benefits",
      "icon": "üèõÔ∏è",
      "help_text": "Enter your monthly Social Security retirement or disability benefits.",
      "fields": [
        {
          "key": "ss_monthly",
          "label": "Social Security Monthly Benefit",
          "type": "currency",
          "required": false,
          "min": 0,
          "max": 5000,
          "step": 10,
          "default": 0,
          "help": "Enter the monthly Social Security benefit amount"
        }
      ]
    },
    {
      "id": "results",
      "type": "results",
      "title": "Income Assessment Complete",
      "icon": "‚úÖ",
      "fields": []
    }
  ],
  "summary": {
    "type": "calculated",
    "label": "Total Monthly Income",
    "formula": "sum(ss_monthly)",
    "display_format": "${:,.0f}/month"
  },
  "output_contract": {
    "ss_monthly": "number",
    "total_monthly_income": "calculated"
  }
}
